{
  "assignee": "Claude",
  "checklist": [],
  "code": "8c.4",
  "created_at": "2026-10-21T04:34:11.028Z",
  "description": "Cambiar de proveedor y modo desde Settings sin reiniciar; en híbrido la sugerencia local nunca se demora por el LLM (proveedor falso lento); latencias p50 por fuente en el log. Ollama real si está instalado. Actualizar progress.",
  "done_at": "2026-10-29T22:15:09.724Z",
  "milestone": "m10",
  "notes": "Ollama y llama.cpp no están instalados en esta máquina: no se probó contra un modelo real (pasos manuales en progress.md M8c). Revisión de código del diff hecha y corregida (progress.md M8c › Revisión de código): body de error al log, JSON de perfiles con tipos inválidos, redirecciones que reenviaban key y código (max_redirects 0, body ≤ 1 MB), Codestral/Gemini sin key, suffix con caret al final de línea, HTTPRequest sin liberar en un controller reemplazado. Además is_remote con [::1] y keys sin guiones. Los settings del paso del editor son los EditorSettings reales y se restauran al terminar.",
  "order": -2,
  "priority": "high",
  "refs": [],
  "size": "s",
  "status": "done",
  "test": "Matriz en 4.4.1, 4.7.2 y 4.8-beta1: run_all 131 tests / 995 checks, acp_session_check 90, oneshot_check 34, cycle test y --godot-agent-completion-test con el paso híbrido contra tests/fake_llm_server.gd (cambio de modo sin reiniciar, un solo pedido con modelo y prefix, marcador, error, vuelta a local sin pedidos). Lo local nunca espera al LLM: test_hybrid_mode con un proveedor falso de 300 ms en vuelo.",
  "title": "Verificar M8c",
  "updated_at": "2026-10-29T22:15:09.724Z"
}
