{
  "assignee": "Claude",
  "checklist": [],
  "code": "1.3",
  "created_at": "2026-10-21T04:32:00.646Z",
  "description": "Mapa id → pendiente, request(method, params) usable con await, notify(), handlers para requests entrantes del agente, -32601 para métodos desconocidos, JSON inválido logueado sin romper (spec §4).",
  "done_at": "2026-10-29T22:13:43.222Z",
  "milestone": "m01",
  "notes": "addons/godot_agent/acp/acp_client.gd.\n- Los ids float del JSON se normalizan a int.\n- Un handler puede devolver un valor o un AcpClient.Response.failure(...).\n- Cada mensaje queda en el log, en el canal acp, con su raw.",
  "order": 0.5,
  "priority": "high",
  "refs": [],
  "size": "m",
  "status": "done",
  "test": "tests/unit/test_acp_client.gd (7 tests) cubre:\n- ids fuera de orden;\n- líneas vacías e inválidas;\n- -32601;\n- handlers sync y async;\n- notificaciones;\n- fail_all_pending;\n- fallo de envío.",
  "title": "AcpClient: JSON-RPC 2.0 sobre líneas",
  "updated_at": "2026-10-29T22:13:43.222Z"
}
