{
  "checklist": [],
  "code": "",
  "created_at": "2026-10-29T21:59:57.040Z",
  "description": "Pedido del usuario (29/10): que un proyecto en C# tenga lo mismo que uno en GDScript. Hoy el addon da por hecho .gd en:\n- Verificación al terminar el turno y get_errors (mcp/tools/diagnostic_tools.gd:66, 111, 200): solo mira .gd. Para C#: dotnet build del proyecto (con el SDK detectado) y sus errores con archivo y línea; si no hay SDK o el editor no es la versión .NET, avisarlo una vez.\n- Adjuntar un script a un nodo (mcp/tools/scene_edit_tools.gd:583) y abrir con godot.* (project_tools.gd:182): aceptar .cs.\n- Sincronizar el buffer del Script Editor (editor/editor_sync.gd:374): sin editor externo configurado (el default, «None»), Godot .NET abre los .cs en el Script Editor interno (comprobado en 4.7.2 mono, 29/10), así que hay que sincronizarlos igual que los .gd; con Rider o VS Code, recargar el assembly después del build.\n- Mover archivos (file_tools.gd:108) y la búsqueda de referencias (m14-05): los .cs referencian por namespace y clase, no por ruta.\n- Menciones @ (ui/editor_context.gd:8) y Revisar (hallazgos en el Script Editor; con editor externo, el link debe abrir file:line ahí).\n- Completado predictivo para C#: en m14-08.\n- Remote watch (session/remote_watch.gd:13): sumar cs y csproj.\n- Prompt de sistema y Alt+I: reglas de C# en Godot (clases partial, señales con [Signal] y EventHandler, [Export], nombres en PascalCase, GD.Print), con lo de m14-06 en su versión C# (de walker, engines/godot.md).\n- Tests: un proyecto de prueba en C# en la matriz de CI con la versión .NET de Godot (4.7.2 y 4.8).",
  "milestone": "m14",
  "notes": "",
  "order": 7,
  "refs": [],
  "status": "todo",
  "test": "",
  "title": "C# con el mismo soporte que GDScript",
  "updated_at": "2026-10-29T21:59:57.286Z"
}
