{
  "assignee": "Claude",
  "checklist": [],
  "code": "1.2",
  "created_at": "2026-10-21T04:32:00.594Z",
  "description": "OS.execute_with_pipe con el comando del perfil; Thread lector de stdout línea por línea y otro de stderr; send_line(String); señales line_received, stderr_received y exited(code) vía call_deferred. Mata el proceso al deshabilitar el plugin o cerrar el editor (spec §3, §15).",
  "done_at": "2026-10-29T22:13:42.518Z",
  "milestone": "m01",
  "notes": "addons/godot_agent/transport/:\n- agent_process.gd: hay threads para stdout, stderr y un watcher de salida. El exit se emite después de la última línea de stdout.\n- process_tree.gd: mata el árbol de procesos con pgrep -P / taskkill /T. Además se recuerdan los hijos, porque npx deja huérfano a node.\n- command_resolver.gd: busca el comando en PATH y en las carpetas de fnm, nvm, volta y similares, y agrega la carpeta del ejecutable al PATH del hijo.\n\nBug en Godot 4.4.x, corregido en 4.5 (verificado con 4.5.1 y 4.6): cerrar o liberar el FileAccess de un pipe de execute_with_pipe cierra fds equivocados, incluso el fd 0, y el siguiente proceso muere con SIGPIPE. Workaround: en 4.4 los pipes viejos se retienen en un array estático (pipe_close_is_broken). Anotar en D11.\n\nOS.is_process_running da error con pids que no son hijos directos o que ya fueron cosechados.",
  "order": 0,
  "priority": "high",
  "refs": [],
  "size": "m",
  "status": "done",
  "test": "tests/acp_session_check.gd lanza el agente falso como proceso real y pasa los escenarios basic, cancel y crash (32 checks) en 4.4.1, 4.7.2 y 4.8-beta1. El proceso queda muerto después de stop().",
  "title": "AgentProcess: lanzar el agente y leer stdout/stderr en threads",
  "updated_at": "2026-10-29T22:13:42.518Z"
}
