{
  "checklist": [],
  "code": "13.8",
  "created_at": "2026-10-30T22:47:04.500Z",
  "description": "La foto sale en el momento del hallazgo, con un mínimo de tiempo entre capturas y una por firma (runtime.py:594). Va junto con los detectores.",
  "milestone": "m15",
  "notes": "Una foto por firma, 5 s entre fotos, se guardan las últimas 50.",
  "order": 8,
  "priority": "medium",
  "refs": [],
  "size": "s",
  "status": "review",
  "tags": [
    "autopilot",
    "playtest"
  ],
  "test": "tests/run_in_xvfb.sh --godot-agent-run-test en 4.7.2, función _check_playtest_game: la foto queda en disco.",
  "title": "Captura automática al detectar un problema",
  "updated_at": "2026-10-30T23:19:11.899Z"
}
