{
  "checklist": [],
  "code": "13.15",
  "created_at": "2026-10-30T22:47:06.296Z",
  "description": "Hoy no hay nada parecido. notes.md con hechos verificados (controles, mecánicas, trampas) y los scripts que sirvieron, más qué archivos cambiaron desde el último run y la regla de volver a comprobar una nota sobre código cambiado (memory.py, codex.py:changes).",
  "links": [
    {
      "task": "m15-17",
      "type": "blocks"
    }
  ],
  "milestone": "m15",
  "notes": "review/playtest_memory.gd. El agente pasa notes y stale_notes en su JSON y el harness escribe: un playtest no modifica el proyecto.",
  "order": 15,
  "priority": "medium",
  "refs": [],
  "size": "m",
  "status": "review",
  "tags": [
    "autopilot",
    "playtest"
  ],
  "test": "test_review_store.test_playtest_memory; review-test.",
  "title": "Memoria por juego",
  "updated_at": "2026-10-30T23:19:15.366Z"
}
