{
  "checklist": [],
  "code": "14.6",
  "created_at": "2026-10-31T04:31:01.037Z",
  "description": "Un playtest que pasó deja su game_script: volver a correrlo sin agente da regresiones sin gastar tokens, también en CI.",
  "milestone": "m16",
  "notes": "",
  "order": 6,
  "priority": "high",
  "refs": [],
  "size": "l",
  "status": "todo",
  "tags": [
    "playtest"
  ],
  "test": "",
  "title": "Repetir un playtest sin agente",
  "updated_at": "2026-10-31T04:31:01.037Z"
}
